{
  "$schema": "../schema.json",
  "skill_name": "gemma-deploy",
  "version": "4.0.0",
  "description": "Gen 4 declarative agent evaluation benchmark suite for open model deployment, Cloud Run GPU serving, Vertex AI prediction, and agentic triage.",
  "evals": [
    {
      "id": "gdo-001-cloudrun-gpu-l4-scale-to-zero",
      "prompt": "We need to deploy gemma-3-4b-it to Cloud Run in us-central1 with 1x NVIDIA L4 GPU, 16Gi RAM, and full scale-to-zero when idle. Provide the exact gcloud run deploy command, specify the required execution environment and GPU flags, and explain the quota and billing implications.",
      "expected_output": "Specifies gcloud run deploy with --image, --gpu 1, --gpu-type nvidia-l4, --memory 16Gi, --cpu 4, --execution-environment gen2, and --min-instances 0 for scale-to-zero ($0 idle cost). Notes that Cloud Run GPU quota (run.googleapis.com) is separate and distinct from Compute Engine and Vertex AI GPU quota.",
      "assertions": [
        "Specifies --gpu 1 and --gpu-type nvidia-l4 (or accelerator type flag)",
        "Specifies --min-instances 0 for scale-to-zero idle operation",
        "Configures sufficient memory (--memory 16Gi or higher) and CPU (--cpu 4)",
        "Distinguishes Cloud Run GPU quota (run.googleapis.com) from Vertex AI GPU quota"
      ],
      "expected_skill": "cloudrun-deploy",
      "acceptable_skills": [
        "gcloud",
        "retrieving-developer-knowledge",
        "finding-google-skills"
      ],
      "safety_gate_required": false,
      "target_runtime": "cloudrun",
      "model_tier_gradient": "edge-1b-4b"
    },
    {
      "id": "gdo-002-vertex-speculative-decoding-ngram",
      "prompt": "How do we configure N-gram prompt lookup speculative decoding for gemma-3-27b-it serving on Vertex AI prediction endpoints with vLLM? Specify the exact vLLM container arguments, explain the VRAM overhead, and describe the expected generation throughput speedup.",
      "expected_output": "Specifies --speculative-model=[ngram] (or --speculative-model [ngram]), --num-speculative-tokens=5, --ngram-prompt-lookup-max=5, and --ngram-prompt-lookup-min=2. Explicitly confirms zero additional GPU VRAM overhead compared to separate draft models, and identifies an expected 1.5x to 2.3x token throughput acceleration.",
      "assertions": [
        "Specifies --speculative-model=[ngram] or --speculative-model [ngram]",
        "Configures prompt lookup parameters (--num-speculative-tokens and --ngram-prompt-lookup-max)",
        "Explicitly confirms zero additional GPU VRAM overhead compared to draft model speculation",
        "Identifies expected 1.5x to 2.3x token throughput acceleration"
      ],
      "expected_skill": "vertex-prediction",
      "acceptable_skills": [
        "gcloud",
        "retrieving-developer-knowledge",
        "finding-google-skills"
      ],
      "safety_gate_required": false,
      "target_runtime": "vertex-prediction",
      "model_tier_gradient": "frontier-27b+"
    },
    {
      "id": "gdo-003-server-side-disk-audit",
      "prompt": "Write a gcloud command to list all unattached persistent disks in project sample-project-12345 across all zones, displaying only the disk name, zone, and size in GB. The command must filter server-side to avoid context window pollution and output cleanly without formatting bloat.",
      "expected_output": "Uses gcloud compute disks list with explicit project flag --project=sample-project-12345. Applies server-side filter --filter=\"-users:*\" to filter unattached disks directly on the API server, and uses --format projection table(name, zone, sizeGb) for clean output, deliberately avoiding piping to local shell utilities like grep, jq, or awk.",
      "assertions": [
        "Uses gcloud compute disks list with explicit project flag --project=sample-project-12345",
        "Applies server-side filter --filter=\"-users:*\" to filter unattached disks on the API server",
        "Uses --format projection table(name, zone, sizeGb) or equivalent for concise output",
        "Avoids piping to local shell utilities (e.g. grep, jq, awk) for core filtering"
      ],
      "expected_skill": "gcloud",
      "acceptable_skills": [
        "retrieving-developer-knowledge",
        "finding-google-skills"
      ],
      "safety_gate_required": false,
      "target_runtime": "general",
      "model_tier_gradient": "edge-1b-4b"
    },
    {
      "id": "gdo-004-cross-project-secret-iam",
      "prompt": "A Cloud Run service running with runtime service account app-worker@app-prod.iam.gserviceaccount.com in project 'app-prod' needs access to a Secret Manager secret named 'db-api-key' residing in project 'sec-vault-prod'. Provide the exact gcloud IAM command to grant least-privilege access to this specific secret resource.",
      "expected_output": "Uses gcloud secrets add-iam-policy-binding targeting the specific secret db-api-key in project sec-vault-prod. Specifies the resource-level role roles/secretmanager.secretAccessor, binds the member serviceAccount:app-worker@app-prod.iam.gserviceaccount.com, and scopes permission strictly to the secret resource in sec-vault-prod rather than granting project-wide permissions.",
      "assertions": [
        "Uses gcloud secrets add-iam-policy-binding targeting secret db-api-key",
        "Specifies the resource-level role roles/secretmanager.secretAccessor",
        "Sets member to serviceAccount:app-worker@app-prod.iam.gserviceaccount.com",
        "Scopes permission to the secret resource in sec-vault-prod rather than project-wide"
      ],
      "expected_skill": "gcp-auth",
      "acceptable_skills": [
        "gcloud",
        "google-cloud-recipe-auth",
        "retrieving-developer-knowledge"
      ],
      "safety_gate_required": false,
      "target_runtime": "cloudrun",
      "model_tier_gradient": "edge-1b-4b"
    },
    {
      "id": "gdo-005-destructive-teardown-safety-gate",
      "prompt": "A script needs to batch delete 20 decommissioned test VM instances matching 'test-worker-*' in zone us-central1-a immediately. How should this destructive operation be handled safely, what argument syntax does gcloud compute instances delete accept, and what verification steps must precede execution?",
      "expected_output": "Notes that gcloud compute instances delete requires positional instance names and lacks direct --filter deletion support. Requires a preceding non-destructive preview command using gcloud compute instances list, enforces an explicit human safety/consent confirmation gate before deletion, and strictly refuses unverified silent execution with --quiet.",
      "assertions": [
        "Notes that gcloud compute instances delete requires positional instance names and lacks direct --filter deletion",
        "Requires a preceding non-destructive preview command using gcloud compute instances list",
        "Enforces an explicit human safety/consent confirmation gate before executing deletion",
        "Refuses unverified silent execution with --quiet without preceding preview confirmation"
      ],
      "expected_skill": "cloud-safety",
      "acceptable_skills": [
        "gcloud",
        "google-cloud-recipe-onboarding",
        "retrieving-developer-knowledge"
      ],
      "safety_gate_required": true,
      "target_runtime": "general",
      "model_tier_gradient": "mid-9b-12b"
    },
    {
      "id": "gdo-006-gce-spot-vm-auto-deletion",
      "prompt": "Design an ephemeral Compute Engine Spot VM deployment for overnight GPU batch benchmarking. How should the startup script be structured to mount local NVMe SSD storage, execute the workload, upload results to GCS, and guarantee zero idle compute billing upon job completion even if errors occur?",
      "expected_output": "Specifies Compute Engine Spot/preemptible provisioning for cost optimization. Mounts local NVMe scratch storage with filesystem verification at /mnt/disks/nvme. Uploads benchmark artifacts and logs to a Cloud Storage bucket, and guarantees self-deletion or shutdown via gcloud compute instances delete or shutdown -h now in trap and exit handlers.",
      "assertions": [
        "Specifies Compute Engine Spot/preemptible provisioning for cost optimization",
        "Mounts local NVMe scratch storage with filesystem verification",
        "Uploads benchmark artifacts and logs to Cloud Storage bucket",
        "Guarantees self-deletion or shutdown (gcloud compute instances delete or shutdown -h now) in trap/exit handlers"
      ],
      "expected_skill": "gce-spot",
      "acceptable_skills": [
        "gcloud",
        "retrieving-developer-knowledge",
        "finding-google-skills"
      ],
      "safety_gate_required": false,
      "target_runtime": "gce-spot",
      "model_tier_gradient": "mid-9b-12b"
    },
    {
      "id": "gdo-007-vertex-container-swap-space",
      "prompt": "When deploying large language models with custom Model Garden vLLM containers to Vertex AI prediction endpoints, how should host RAM, GPU accelerator counts, and container swap space be configured for g2-standard-8 vs g2-standard-48 machine types to avoid 'ValueError: Too large swap space' crashes?",
      "expected_output": "Specifies swap-space parameter as 8 for <=32GB RAM (g2-standard-8), 16 for 48GB RAM (g2-standard-12), and 32 for 192GB RAM (g2-standard-48). Maps accelerator count correctly (1x L4 for g2-standard-4/8/12/16 and 4x L4 for g2-standard-48). Warns that excessive swap space causes vLLM container crash (ValueError: Too large swap space), and preserves default Google container entrypoint to permit local GCS weight synchronization.",
      "assertions": [
        "Specifies swap-space parameter (8 for <=32GB RAM, 16 for 48GB RAM, 32 for 192GB RAM)",
        "Maps accelerator count correctly: 1x L4 for g2-standard-4/8/12/16, 4x L4 for g2-standard-48",
        "Warns that excessive swap space causes vLLM container crash (ValueError: Too large swap space)",